{
  "contract_version": "1.0.0",
  "trace_id": "e2-example-001",
  "job_id": "bc-001",
  "job_type": "BUILD_CHECKER",
  "status": "SUCCEEDED",
  "progress_percent": 100,
  "created_at": "2026-09-22T12:00:00Z",
  "updated_at": "2026-09-22T12:01:00Z",
  "finished_at": "2026-09-22T12:01:00Z",
  "input_artifacts": [
    {
      "artifact_id": "draft-image",
      "kind": "CONTAINER_IMAGE",
      "uri": "https://artifacts.example.org/e2/draft-image",
      "media_type": "application/vnd.oci.image.manifest.v1+json",
      "sha256": "aaaaaaaaaaaaaaaaaaaaaaaaaaaaaaaaaaaaaaaaaaaaaaaaaaaaaaaaaaaaaaaa",
      "produced_by_job_id": "draft-001",
      "source_commit": "0123456789abcdef0123456789abcdef01234567",
      "configuration_digest": "make-debug-linux-v1",
      "created_at": "2026-09-22T12:00:00Z"
    }
  ],
  "output_artifacts": [
    {
      "artifact_id": "bc-actual-graph",
      "kind": "ACTUAL_DEPENDENCY_GRAPH",
      "uri": "https://artifacts.example.org/e2/bc-actual-graph",
      "media_type": "application/json",
      "sha256": "aaaaaaaaaaaaaaaaaaaaaaaaaaaaaaaaaaaaaaaaaaaaaaaaaaaaaaaaaaaaaaaa",
      "produced_by_job_id": "bc-001",
      "source_commit": "0123456789abcdef0123456789abcdef01234567",
      "configuration_digest": "make-debug-linux-v1",
      "created_at": "2026-09-22T12:00:00Z"
    },
    {
      "artifact_id": "bc-declared-graph",
      "kind": "DECLARED_DEPENDENCY_GRAPH",
      "uri": "https://artifacts.example.org/e2/bc-declared-graph",
      "media_type": "application/json",
      "sha256": "aaaaaaaaaaaaaaaaaaaaaaaaaaaaaaaaaaaaaaaaaaaaaaaaaaaaaaaaaaaaaaaa",
      "produced_by_job_id": "bc-001",
      "source_commit": "0123456789abcdef0123456789abcdef01234567",
      "configuration_digest": "make-debug-linux-v1",
      "created_at": "2026-09-22T12:00:00Z"
    },
    {
      "artifact_id": "bc-report",
      "kind": "FULL_CHECK_REPORT",
      "uri": "https://artifacts.example.org/e2/bc-report",
      "media_type": "application/json",
      "sha256": "aaaaaaaaaaaaaaaaaaaaaaaaaaaaaaaaaaaaaaaaaaaaaaaaaaaaaaaaaaaaaaaa",
      "produced_by_job_id": "bc-001",
      "source_commit": "0123456789abcdef0123456789abcdef01234567",
      "configuration_digest": "make-debug-linux-v1",
      "created_at": "2026-09-22T12:00:00Z"
    },
    {
      "artifact_id": "bc-log",
      "kind": "BUILD_LOG",
      "uri": "https://artifacts.example.org/e2/bc-log",
      "media_type": "text/plain",
      "sha256": "aaaaaaaaaaaaaaaaaaaaaaaaaaaaaaaaaaaaaaaaaaaaaaaaaaaaaaaaaaaaaaaa",
      "produced_by_job_id": "bc-001",
      "source_commit": "0123456789abcdef0123456789abcdef01234567",
      "configuration_digest": "make-debug-linux-v1",
      "created_at": "2026-09-22T12:00:00Z"
    }
  ],
  "findings": [
    {
      "finding_id": "bc-finding-001",
      "source_commit": "0123456789abcdef0123456789abcdef01234567",
      "configuration_id": "make-debug-linux-v1",
      "target": "build/app",
      "location": {
        "path": "Makefile",
        "line": 8,
        "column": 1
      },
      "category": "MISSING",
      "severity": "WARNING",
      "message": "实际读取 include/config.h，但目标未声明该前置依赖。",
      "dependency": {
        "ecosystem": "make",
        "name": "include/config.h",
        "scope": "build"
      },
      "evidence": [
        "artifact:bc-actual-graph#/edges/0",
        "artifact:bc-declared-graph#/edges",
        "artifact:bc-log#L10-L30"
      ]
    },
    {
      "finding_id": "bc-finding-002",
      "source_commit": "0123456789abcdef0123456789abcdef01234567",
      "configuration_id": "make-debug-linux-v1",
      "target": "build/app",
      "location": {
        "path": "Makefile",
        "line": 8,
        "column": 1
      },
      "category": "REDUNDANT",
      "severity": "WARNING",
      "message": "本次完整构建未观察到对已声明依赖 include/unused.h 的读取。",
      "dependency": {
        "ecosystem": "make",
        "name": "include/unused.h",
        "scope": "build"
      },
      "evidence": [
        "artifact:bc-declared-graph#/edges/1",
        "artifact:bc-actual-graph#/edges",
        "artifact:bc-log#L10-L30"
      ]
    }
  ],
  "error": null
}
