{
  "contract_version": "1.0.0",
  "trace_id": "e2-demo-20260922-draft-buildchecker-001",
  "job_id": "draft-01j8h9ks2ydqmv8p3btygh3e0k",
  "job_type": "DRAFT",
  "status": "SUCCEEDED",
  "progress_percent": 100,
  "created_at": "2026-09-22T09:00:00Z",
  "updated_at": "2026-09-22T09:08:42Z",
  "finished_at": "2026-09-22T09:08:42Z",
  "input_artifacts": [],
  "output_artifacts": [
    {
      "artifact_id": "artifact-draft-environment-manifest-001",
      "kind": "DRAFT_ENVIRONMENT_MANIFEST",
      "uri": "https://artifacts.example.edu/e2/draft-01j8h9ks2ydqmv8p3btygh3e0k/environment-manifest.json",
      "media_type": "application/json",
      "sha256": "33e0d0762ca1fa2d5d3d75b3e1188da7c639a0b3f9aef0ebddfca6c94a93d5a1",
      "size_bytes": 1832,
      "produced_by_job_id": "draft-01j8h9ks2ydqmv8p3btygh3e0k",
      "source_commit": "0123456789abcdef0123456789abcdef01234567",
      "configuration_digest": "sha256:ed50c8428eb0b998e77dfd71e9f4b98a8ea6974c0b56d9b8ef2fa89d472f60d1",
      "created_at": "2026-09-22T09:08:41Z"
    },
    {
      "artifact_id": "artifact-draft-container-image-001",
      "kind": "CONTAINER_IMAGE",
      "uri": "oci://registry.example.edu/e2/checkout-service@sha256:5b703879df7f0cc99a5a91dc0759158fc4e2575805d5509cc21cb2030b8611dc",
      "media_type": "application/vnd.oci.image.manifest.v1+json",
      "sha256": "5b703879df7f0cc99a5a91dc0759158fc4e2575805d5509cc21cb2030b8611dc",
      "size_bytes": 5834,
      "produced_by_job_id": "draft-01j8h9ks2ydqmv8p3btygh3e0k",
      "source_commit": "0123456789abcdef0123456789abcdef01234567",
      "configuration_digest": "sha256:ed50c8428eb0b998e77dfd71e9f4b98a8ea6974c0b56d9b8ef2fa89d472f60d1",
      "created_at": "2026-09-22T09:08:40Z"
    },
    {
      "artifact_id": "artifact-draft-build-log-001",
      "kind": "BUILD_LOG",
      "uri": "https://artifacts.example.edu/e2/draft-01j8h9ks2ydqmv8p3btygh3e0k/build.log",
      "media_type": "text/plain; charset=utf-8",
      "sha256": "a4cded58340b7ca6b3a12c3622ac434ab97f5ae1fb5266064fc30a5a505c040b",
      "size_bytes": 41728,
      "produced_by_job_id": "draft-01j8h9ks2ydqmv8p3btygh3e0k",
      "source_commit": "0123456789abcdef0123456789abcdef01234567",
      "configuration_digest": "sha256:ed50c8428eb0b998e77dfd71e9f4b98a8ea6974c0b56d9b8ef2fa89d472f60d1",
      "created_at": "2026-09-22T09:08:18Z"
    },
    {
      "artifact_id": "artifact-draft-validation-log-001",
      "kind": "VALIDATION_LOG",
      "uri": "https://artifacts.example.edu/e2/draft-01j8h9ks2ydqmv8p3btygh3e0k/validation.log",
      "media_type": "text/plain; charset=utf-8",
      "sha256": "b0522ba89cc791c49f7856760132493f6ecc8b019a0c74f4d4688df2685e1bb5",
      "size_bytes": 12736,
      "produced_by_job_id": "draft-01j8h9ks2ydqmv8p3btygh3e0k",
      "source_commit": "0123456789abcdef0123456789abcdef01234567",
      "configuration_digest": "sha256:ed50c8428eb0b998e77dfd71e9f4b98a8ea6974c0b56d9b8ef2fa89d472f60d1",
      "created_at": "2026-09-22T09:08:39Z"
    }
  ],
  "findings": [],
  "error": null
}
